# Real macOS capture — MacBook M4 Pro (2025), latest macOS, iCloud Private Relay off
# decoded: TTL64, win65535, wscale6, opts mss,nop,ws,nop,nop,ts,sok,eol; Flags [S] (no ECN observed on this path)
20:28:00.440403 eth0  In  IP (tos 0x0, ttl 56, id 0, offset 0, flags [DF], proto TCP (6), length 64)
    198.51.100.10.65068 > 203.0.113.10.18000: Flags [S], cksum 0x0cfa (correct), seq 3858838128, win 65535, options [mss 1360,nop,wscale 6,nop,nop,TS val 2624402416 ecr 0,sackOK,eol], length 0
20:28:01.526079 eth0  In  IP (tos 0x0, ttl 56, id 0, offset 0, flags [DF], proto TCP (6), length 64)
    198.51.100.10.65069 > 203.0.113.10.18000: Flags [S], cksum 0xcd76 (correct), seq 3108261540, win 65535, options [mss 1360,nop,wscale 6,nop,nop,TS val 2931913127 ecr 0,sackOK,eol], length 0
20:28:02.335200 eth0  In  IP (tos 0x0, ttl 56, id 0, offset 0, flags [DF], proto TCP (6), length 64)
    198.51.100.10.65070 > 203.0.113.10.18000: Flags [S], cksum 0xacb9 (correct), seq 961771193, win 65535, options [mss 1360,nop,wscale 6,nop,nop,TS val 1123505674 ecr 0,sackOK,eol], length 0
20:28:04.887371 eth0  In  IP (tos 0x0, ttl 56, id 0, offset 0, flags [DF], proto TCP (6), length 64)
    198.51.100.10.65072 > 203.0.113.10.80: Flags [S], cksum 0xb79d (correct), seq 1527892044, win 65535, options [mss 1360,nop,wscale 6,nop,nop,TS val 3764944993 ecr 0,sackOK,eol], length 0
20:28:05.033828 eth0  In  IP (tos 0x0, ttl 56, id 0, offset 0, flags [DF], proto TCP (6), length 64)
    198.51.100.10.65073 > 203.0.113.10.80: Flags [S], cksum 0xc47d (correct), seq 2694707588, win 65535, options [mss 1360,nop,wscale 6,nop,nop,TS val 1299222452 ecr 0,sackOK,eol], length 0

